{
  "schema_version": "0.6",
  "reconciliation_event_id": "rev_01JZ8QAB",
  "occurred_at": "2026-07-28T06:01:11.000Z",
  "delegation_id": "del_abc123",
  "client_id": "app_natureguard",
  "request_id": "req_88",
  "source_usage_event_id": "uev_gateway_01JZ8Q8V",
  "provider_request_id": "prov_req_782",
  "provider_billing_record_ref": "billing_record_884",
  "status": "adjusted",
  "original_quantity": 2.5,
  "provider_final_quantity": 3.0,
  "adjustment_quantity": 0.5,
  "unit_type": "provider_ai_unit",
  "funding_bucket_ref": "bucket_pairwise_7f2",
  "late_usage": true,
  "action": "adjustment_required",
  "adjustment_ledger_event_id": "lev_adj_88",
  "idempotency_key": "idem_recon_prov_req_782"
}
